No.     Time           Source                Destination           Protocol Length Info
      1 0.000000       134.188.170.174       134.188.170.175       TLSv1.2  97     Application Data

Frame 1: 97 bytes on wire (776 bits), 97 bytes captured (776 bits) on interface \Device\NPF_{33602CCE-19C0-4AAE-AECC-78912587524B}, id 0
    Section number: 1
    Interface id: 0 (\Device\NPF_{33602CCE-19C0-4AAE-AECC-78912587524B})
        Interface name: \Device\NPF_{33602CCE-19C0-4AAE-AECC-78912587524B}
        Interface description: Ethernet
    Encapsulation type: Ethernet (1)
    Arrival Time: Dec 14, 2022 10:37:36.746819000 W. Europe Standard Time
    [Time shift for this packet: 0.000000000 seconds]
    Epoch Time: 1671010656.746819000 seconds
    [Time delta from previous captured frame: 0.000000000 seconds]
    [Time delta from previous displayed frame: 0.000000000 seconds]
    [Time since reference or first frame: 0.000000000 seconds]
    Frame Number: 1
    Frame Length: 97 bytes (776 bits)
    Capture Length: 97 bytes (776 bits)
    [Frame is marked: False]
    [Frame is ignored: False]
    [Protocols in frame: eth:ethertype:ip:tcp:tls]
    [Coloring Rule Name: TCP]
    [Coloring Rule String: tcp]
Ethernet II, Src: Fujitsu_b0:3f:15 (a0:66:10:b0:3f:15), Dst: FujitsuT_11:23:49 (90:1b:0e:11:23:49)
    Destination: FujitsuT_11:23:49 (90:1b:0e:11:23:49)
        Address: FujitsuT_11:23:49 (90:1b:0e:11:23:49)
        .... ..0. .... .... .... .... = LG bit: Globally unique address (factory default)
        .... ...0 .... .... .... .... = IG bit: Individual address (unicast)
    Source: Fujitsu_b0:3f:15 (a0:66:10:b0:3f:15)
        Address: Fujitsu_b0:3f:15 (a0:66:10:b0:3f:15)
        .... ..0. .... .... .... .... = LG bit: Globally unique address (factory default)
        .... ...0 .... .... .... .... = IG bit: Individual address (unicast)
    Type: IPv4 (0x0800)
Internet Protocol Version 4, Src: 134.188.170.174, Dst: 134.188.170.175
    0100 .... = Version: 4
    .... 0101 = Header Length: 20 bytes (5)
    Differentiated Services Field: 0x00 (DSCP: CS0, ECN: Not-ECT)
        0000 00.. = Differentiated Services Codepoint: Default (0)
        .... ..00 = Explicit Congestion Notification: Not ECN-Capable Transport (0)
    Total Length: 83
    Identification: 0x1dd6 (7638)
    010. .... = Flags: 0x2, Don't fragment
        0... .... = Reserved bit: Not set
        .1.. .... = Don't fragment: Set
        ..0. .... = More fragments: Not set
    ...0 0000 0000 0000 = Fragment Offset: 0
    Time to Live: 128
    Protocol: TCP (6)
    Header Checksum: 0x79f8 [validation disabled]
    [Header checksum status: Unverified]
    Source Address: 134.188.170.174
    Destination Address: 134.188.170.175
Transmission Control Protocol, Src Port: 52728, Dst Port: 3389, Seq: 1, Ack: 1, Len: 43
    Source Port: 52728
    Destination Port: 3389
    [Stream index: 0]
    [Conversation completeness: Incomplete (12)]
    [TCP Segment Len: 43]
    Sequence Number: 1    (relative sequence number)
    Sequence Number (raw): 3951497563
    [Next Sequence Number: 44    (relative sequence number)]
    Acknowledgment Number: 1    (relative ack number)
    Acknowledgment number (raw): 1607889351
    0101 .... = Header Length: 20 bytes (5)
    Flags: 0x018 (PSH, ACK)
        000. .... .... = Reserved: Not set
        ...0 .... .... = Accurate ECN: Not set
        .... 0... .... = Congestion Window Reduced: Not set
        .... .0.. .... = ECN-Echo: Not set
        .... ..0. .... = Urgent: Not set
        .... ...1 .... = Acknowledgment: Set
        .... .... 1... = Push: Set
        .... .... .0.. = Reset: Not set
        .... .... ..0. = Syn: Not set
        .... .... ...0 = Fin: Not set
        [TCP Flags: ·······AP···]
    Window: 8212
    [Calculated window size: 8212]
    [Window size scaling factor: -1 (unknown)]
    Checksum: 0xe81f [unverified]
    [Checksum Status: Unverified]
    Urgent Pointer: 0
    [Timestamps]
        [Time since first frame in this TCP stream: 0.000000000 seconds]
        [Time since previous frame in this TCP stream: 0.000000000 seconds]
    [SEQ/ACK analysis]
        [Bytes in flight: 43]
        [Bytes sent since last PSH flag: 43]
    TCP payload (43 bytes)
Transport Layer Security
    TLSv1.2 Record Layer: Application Data Protocol: TPKT - ISO on TCP - RFC1006
        Content Type: Application Data (23)
        Version: TLS 1.2 (0x0303)
        Length: 38
        Encrypted Application Data: 00000000000021585c4b173213fb1b6fd074eb80ffe71db04ffaebf2369c5f2b2a03af40…
        [Application Data Protocol: TPKT - ISO on TCP - RFC1006]

No.     Time           Source                Destination           Protocol Length Info
      2 0.007424       134.188.170.174       134.188.170.175       RDPUDP   60     SYNEX,AOA

Frame 2: 60 bytes on wire (480 bits), 60 bytes captured (480 bits) on interface \Device\NPF_{33602CCE-19C0-4AAE-AECC-78912587524B}, id 0
    Section number: 1
    Interface id: 0 (\Device\NPF_{33602CCE-19C0-4AAE-AECC-78912587524B})
        Interface name: \Device\NPF_{33602CCE-19C0-4AAE-AECC-78912587524B}
        Interface description: Ethernet
    Encapsulation type: Ethernet (1)
    Arrival Time: Dec 14, 2022 10:37:36.754243000 W. Europe Standard Time
    [Time shift for this packet: 0.000000000 seconds]
    Epoch Time: 1671010656.754243000 seconds
    [Time delta from previous captured frame: 0.007424000 seconds]
    [Time delta from previous displayed frame: 0.007424000 seconds]
    [Time since reference or first frame: 0.007424000 seconds]
    Frame Number: 2
    Frame Length: 60 bytes (480 bits)
    Capture Length: 60 bytes (480 bits)
    [Frame is marked: False]
    [Frame is ignored: False]
    [Protocols in frame: eth:ethertype:ip:udp:rdpudp]
    [Coloring Rule Name: UDP]
    [Coloring Rule String: udp]
Ethernet II, Src: Fujitsu_b0:3f:15 (a0:66:10:b0:3f:15), Dst: FujitsuT_11:23:49 (90:1b:0e:11:23:49)
    Destination: FujitsuT_11:23:49 (90:1b:0e:11:23:49)
        Address: FujitsuT_11:23:49 (90:1b:0e:11:23:49)
        .... ..0. .... .... .... .... = LG bit: Globally unique address (factory default)
        .... ...0 .... .... .... .... = IG bit: Individual address (unicast)
    Source: Fujitsu_b0:3f:15 (a0:66:10:b0:3f:15)
        Address: Fujitsu_b0:3f:15 (a0:66:10:b0:3f:15)
        .... ..0. .... .... .... .... = LG bit: Globally unique address (factory default)
        .... ...0 .... .... .... .... = IG bit: Individual address (unicast)
    Type: IPv4 (0x0800)
    Padding: 0000
Internet Protocol Version 4, Src: 134.188.170.174, Dst: 134.188.170.175
    0100 .... = Version: 4
    .... 0101 = Header Length: 20 bytes (5)
    Differentiated Services Field: 0x00 (DSCP: CS0, ECN: Not-ECT)
        0000 00.. = Differentiated Services Codepoint: Default (0)
        .... ..00 = Explicit Congestion Notification: Not ECN-Capable Transport (0)
    Total Length: 44
    Identification: 0x1dd7 (7639)
    000. .... = Flags: 0x0
        0... .... = Reserved bit: Not set
        .0.. .... = Don't fragment: Not set
        ..0. .... = More fragments: Not set
    ...0 0000 0000 0000 = Fragment Offset: 0
    Time to Live: 128
    Protocol: UDP (17)
    Header Checksum: 0xba13 [validation disabled]
    [Header checksum status: Unverified]
    Source Address: 134.188.170.174
    Destination Address: 134.188.170.175
User Datagram Protocol, Src Port: 63973, Dst Port: 3389
    Source Port: 63973
    Destination Port: 3389
    Length: 24
    Checksum: 0xd811 [unverified]
    [Checksum Status: Unverified]
    [Stream index: 0]
    [Timestamps]
        [Time since first frame: 0.000000000 seconds]
        [Time since previous frame: 0.000000000 seconds]
    UDP payload (16 bytes)
UDP Remote Desktop Protocol
    snSourceAck: 0xb101c13e
    ReceiveWindowSize: 11863
    Flags: 0x73e0, CN, CWR, Ack of Acks, Syn lossy, SynEx
        .... .... .... ...0 = Syn: False
        .... .... .... ..0. = Fin: False
        .... .... .... .0.. = Ack: False
        .... .... .... 0... = Data: False
        .... .... ...0 .... = FECData: False
        .... .... ..1. .... = CN: True
        .... .... .1.. .... = CWR: True
        .... ...1 .... .... = Ack of Acks: True
        .... ..1. .... .... = Syn lossy: True
        .... .0.. .... .... = Ack delayed: False
        .... 0... .... .... = Correlation id: False
        ...1 .... .... .... = SynEx: True
    SynEx
        Flags: 0x0f03
        .... ...1 = Version info: True
        Version: Unknown (0x2c17)
    snResetSeqNum: 0x64200a00

No.     Time           Source                Destination           Protocol Length Info
      3 0.018435       134.188.170.175       134.188.170.174       RDPUDP   164    CORRELATIONID,AOA

Frame 3: 164 bytes on wire (1312 bits), 164 bytes captured (1312 bits) on interface \Device\NPF_{33602CCE-19C0-4AAE-AECC-78912587524B}, id 0
    Section number: 1
    Interface id: 0 (\Device\NPF_{33602CCE-19C0-4AAE-AECC-78912587524B})
        Interface name: \Device\NPF_{33602CCE-19C0-4AAE-AECC-78912587524B}
        Interface description: Ethernet
    Encapsulation type: Ethernet (1)
    Arrival Time: Dec 14, 2022 10:37:36.765254000 W. Europe Standard Time
    [Time shift for this packet: 0.000000000 seconds]
    Epoch Time: 1671010656.765254000 seconds
    [Time delta from previous captured frame: 0.011011000 seconds]
    [Time delta from previous displayed frame: 0.011011000 seconds]
    [Time since reference or first frame: 0.018435000 seconds]
    Frame Number: 3
    Frame Length: 164 bytes (1312 bits)
    Capture Length: 164 bytes (1312 bits)
    [Frame is marked: False]
    [Frame is ignored: False]
    [Protocols in frame: eth:ethertype:ip:udp:rdpudp]
    [Coloring Rule Name: UDP]
    [Coloring Rule String: udp]
Ethernet II, Src: FujitsuT_11:23:49 (90:1b:0e:11:23:49), Dst: Fujitsu_b0:3f:15 (a0:66:10:b0:3f:15)
    Destination: Fujitsu_b0:3f:15 (a0:66:10:b0:3f:15)
        Address: Fujitsu_b0:3f:15 (a0:66:10:b0:3f:15)
        .... ..0. .... .... .... .... = LG bit: Globally unique address (factory default)
        .... ...0 .... .... .... .... = IG bit: Individual address (unicast)
    Source: FujitsuT_11:23:49 (90:1b:0e:11:23:49)
        Address: FujitsuT_11:23:49 (90:1b:0e:11:23:49)
        .... ..0. .... .... .... .... = LG bit: Globally unique address (factory default)
        .... ...0 .... .... .... .... = IG bit: Individual address (unicast)
    Type: IPv4 (0x0800)
Internet Protocol Version 4, Src: 134.188.170.175, Dst: 134.188.170.174
    0100 .... = Version: 4
    .... 0101 = Header Length: 20 bytes (5)
    Differentiated Services Field: 0x00 (DSCP: CS0, ECN: Not-ECT)
        0000 00.. = Differentiated Services Codepoint: Default (0)
        .... ..00 = Explicit Congestion Notification: Not ECN-Capable Transport (0)
    Total Length: 150
    Identification: 0xda9e (55966)
    000. .... = Flags: 0x0
        0... .... = Reserved bit: Not set
        .0.. .... = Don't fragment: Not set
        ..0. .... = More fragments: Not set
    ...0 0000 0000 0000 = Fragment Offset: 0
    Time to Live: 128
    Protocol: UDP (17)
    Header Checksum: 0x0000 [validation disabled]
    [Header checksum status: Unverified]
    Source Address: 134.188.170.175
    Destination Address: 134.188.170.174
User Datagram Protocol, Src Port: 3389, Dst Port: 63973
    Source Port: 3389
    Destination Port: 63973
    Length: 130
    Checksum: 0x636a [unverified]
    [Checksum Status: Unverified]
    [Stream index: 0]
    [Timestamps]
        [Time since first frame: 0.011011000 seconds]
        [Time since previous frame: 0.011011000 seconds]
    UDP payload (122 bytes)
UDP Remote Desktop Protocol
    snSourceAck: 0x1704c03f
    ReceiveWindowSize: 11871
    Flags: 0x2de0, CN, CWR, Ack of Acks, Ack delayed, Correlation id
        .... .... .... ...0 = Syn: False
        .... .... .... ..0. = Fin: False
        .... .... .... .0.. = Ack: False
        .... .... .... 0... = Data: False
        .... .... ...0 .... = FECData: False
        .... .... ..1. .... = CN: True
        .... .... .1.. .... = CWR: True
        .... ...1 .... .... = Ack of Acks: True
        .... ..0. .... .... = Syn lossy: False
        .... .1.. .... .... = Ack delayed: True
        .... 1... .... .... = Correlation id: True
        ...0 .... .... .... = SynEx: False
    Correlation Id: 0303006e00000000000028bad9ecd535
    snResetSeqNum: 0x865b9fae

No.     Time           Source                Destination           Protocol Length Info
      4 0.024482       134.188.170.174       134.188.170.175       TLSv1.2  111    Application Data

Frame 4: 111 bytes on wire (888 bits), 111 bytes captured (888 bits) on interface \Device\NPF_{33602CCE-19C0-4AAE-AECC-78912587524B}, id 0
    Section number: 1
    Interface id: 0 (\Device\NPF_{33602CCE-19C0-4AAE-AECC-78912587524B})
        Interface name: \Device\NPF_{33602CCE-19C0-4AAE-AECC-78912587524B}
        Interface description: Ethernet
    Encapsulation type: Ethernet (1)
    Arrival Time: Dec 14, 2022 10:37:36.771301000 W. Europe Standard Time
    [Time shift for this packet: 0.000000000 seconds]
    Epoch Time: 1671010656.771301000 seconds
    [Time delta from previous captured frame: 0.006047000 seconds]
    [Time delta from previous displayed frame: 0.006047000 seconds]
    [Time since reference or first frame: 0.024482000 seconds]
    Frame Number: 4
    Frame Length: 111 bytes (888 bits)
    Capture Length: 111 bytes (888 bits)
    [Frame is marked: False]
    [Frame is ignored: False]
    [Protocols in frame: eth:ethertype:ip:tcp:tls]
    [Coloring Rule Name: TCP]
    [Coloring Rule String: tcp]
Ethernet II, Src: Fujitsu_b0:3f:15 (a0:66:10:b0:3f:15), Dst: FujitsuT_11:23:49 (90:1b:0e:11:23:49)
    Destination: FujitsuT_11:23:49 (90:1b:0e:11:23:49)
        Address: FujitsuT_11:23:49 (90:1b:0e:11:23:49)
        .... ..0. .... .... .... .... = LG bit: Globally unique address (factory default)
        .... ...0 .... .... .... .... = IG bit: Individual address (unicast)
    Source: Fujitsu_b0:3f:15 (a0:66:10:b0:3f:15)
        Address: Fujitsu_b0:3f:15 (a0:66:10:b0:3f:15)
        .... ..0. .... .... .... .... = LG bit: Globally unique address (factory default)
        .... ...0 .... .... .... .... = IG bit: Individual address (unicast)
    Type: IPv4 (0x0800)
Internet Protocol Version 4, Src: 134.188.170.174, Dst: 134.188.170.175
    0100 .... = Version: 4
    .... 0101 = Header Length: 20 bytes (5)
    Differentiated Services Field: 0x00 (DSCP: CS0, ECN: Not-ECT)
        0000 00.. = Differentiated Services Codepoint: Default (0)
        .... ..00 = Explicit Congestion Notification: Not ECN-Capable Transport (0)
    Total Length: 97
    Identification: 0x1dd8 (7640)
    010. .... = Flags: 0x2, Don't fragment
        0... .... = Reserved bit: Not set
        .1.. .... = Don't fragment: Set
        ..0. .... = More fragments: Not set
    ...0 0000 0000 0000 = Fragment Offset: 0
    Time to Live: 128
    Protocol: TCP (6)
    Header Checksum: 0x79e8 [validation disabled]
    [Header checksum status: Unverified]
    Source Address: 134.188.170.174
    Destination Address: 134.188.170.175
Transmission Control Protocol, Src Port: 52728, Dst Port: 3389, Seq: 44, Ack: 1, Len: 57
    Source Port: 52728
    Destination Port: 3389
    [Stream index: 0]
    [Conversation completeness: Incomplete (12)]
    [TCP Segment Len: 57]
    Sequence Number: 44    (relative sequence number)
    Sequence Number (raw): 3951497606
    [Next Sequence Number: 101    (relative sequence number)]
    Acknowledgment Number: 1    (relative ack number)
    Acknowledgment number (raw): 1607889351
    0101 .... = Header Length: 20 bytes (5)
    Flags: 0x018 (PSH, ACK)
        000. .... .... = Reserved: Not set
        ...0 .... .... = Accurate ECN: Not set
        .... 0... .... = Congestion Window Reduced: Not set
        .... .0.. .... = ECN-Echo: Not set
        .... ..0. .... = Urgent: Not set
        .... ...1 .... = Acknowledgment: Set
        .... .... 1... = Push: Set
        .... .... .0.. = Reset: Not set
        .... .... ..0. = Syn: Not set
        .... .... ...0 = Fin: Not set
        [TCP Flags: ·······AP···]
    Window: 8212
    [Calculated window size: 8212]
    [Window size scaling factor: -1 (unknown)]
    Checksum: 0xc41a [unverified]
    [Checksum Status: Unverified]
    Urgent Pointer: 0
    [Timestamps]
        [Time since first frame in this TCP stream: 0.024482000 seconds]
        [Time since previous frame in this TCP stream: 0.024482000 seconds]
    [SEQ/ACK analysis]
        [Bytes in flight: 100]
        [Bytes sent since last PSH flag: 57]
    TCP payload (57 bytes)
Transport Layer Security
    TLSv1.2 Record Layer: Application Data Protocol: TPKT - ISO on TCP - RFC1006
        Content Type: Application Data (23)
        Version: TLS 1.2 (0x0303)
        Length: 52
        Encrypted Application Data: 000000000000215918814dfd5da8bd8ebe098af6e0c52b6a9e8e4a06f755e8016811d203…
        [Application Data Protocol: TPKT - ISO on TCP - RFC1006]

No.     Time           Source                Destination           Protocol Length Info
      5 0.024527       134.188.170.175       134.188.170.174       TCP      54     3389 → 52728 [ACK] Seq=1 Ack=101 Win=63185 Len=0

Frame 5: 54 bytes on wire (432 bits), 54 bytes captured (432 bits) on interface \Device\NPF_{33602CCE-19C0-4AAE-AECC-78912587524B}, id 0
    Section number: 1
    Interface id: 0 (\Device\NPF_{33602CCE-19C0-4AAE-AECC-78912587524B})
        Interface name: \Device\NPF_{33602CCE-19C0-4AAE-AECC-78912587524B}
        Interface description: Ethernet
    Encapsulation type: Ethernet (1)
    Arrival Time: Dec 14, 2022 10:37:36.771346000 W. Europe Standard Time
    [Time shift for this packet: 0.000000000 seconds]
    Epoch Time: 1671010656.771346000 seconds
    [Time delta from previous captured frame: 0.000045000 seconds]
    [Time delta from previous displayed frame: 0.000045000 seconds]
    [Time since reference or first frame: 0.024527000 seconds]
    Frame Number: 5
    Frame Length: 54 bytes (432 bits)
    Capture Length: 54 bytes (432 bits)
    [Frame is marked: False]
    [Frame is ignored: False]
    [Protocols in frame: eth:ethertype:ip:tcp]
    [Coloring Rule Name: TCP]
    [Coloring Rule String: tcp]
Ethernet II, Src: FujitsuT_11:23:49 (90:1b:0e:11:23:49), Dst: Fujitsu_b0:3f:15 (a0:66:10:b0:3f:15)
    Destination: Fujitsu_b0:3f:15 (a0:66:10:b0:3f:15)
        Address: Fujitsu_b0:3f:15 (a0:66:10:b0:3f:15)
        .... ..0. .... .... .... .... = LG bit: Globally unique address (factory default)
        .... ...0 .... .... .... .... = IG bit: Individual address (unicast)
    Source: FujitsuT_11:23:49 (90:1b:0e:11:23:49)
        Address: FujitsuT_11:23:49 (90:1b:0e:11:23:49)
        .... ..0. .... .... .... .... = LG bit: Globally unique address (factory default)
        .... ...0 .... .... .... .... = IG bit: Individual address (unicast)
    Type: IPv4 (0x0800)
Internet Protocol Version 4, Src: 134.188.170.175, Dst: 134.188.170.174
    0100 .... = Version: 4
    .... 0101 = Header Length: 20 bytes (5)
    Differentiated Services Field: 0x00 (DSCP: CS0, ECN: Not-ECT)
        0000 00.. = Differentiated Services Codepoint: Default (0)
        .... ..00 = Explicit Congestion Notification: Not ECN-Capable Transport (0)
    Total Length: 40
    Identification: 0xda9f (55967)
    010. .... = Flags: 0x2, Don't fragment
        0... .... = Reserved bit: Not set
        .1.. .... = Don't fragment: Set
        ..0. .... = More fragments: Not set
    ...0 0000 0000 0000 = Fragment Offset: 0
    Time to Live: 128
    Protocol: TCP (6)
    Header Checksum: 0x0000 [validation disabled]
    [Header checksum status: Unverified]
    Source Address: 134.188.170.175
    Destination Address: 134.188.170.174
Transmission Control Protocol, Src Port: 3389, Dst Port: 52728, Seq: 1, Ack: 101, Len: 0
    Source Port: 3389
    Destination Port: 52728
    [Stream index: 0]
    [Conversation completeness: Incomplete (12)]
    [TCP Segment Len: 0]
    Sequence Number: 1    (relative sequence number)
    Sequence Number (raw): 1607889351
    [Next Sequence Number: 1    (relative sequence number)]
    Acknowledgment Number: 101    (relative ack number)
    Acknowledgment number (raw): 3951497663
    0101 .... = Header Length: 20 bytes (5)
    Flags: 0x010 (ACK)
        000. .... .... = Reserved: Not set
        ...0 .... .... = Accurate ECN: Not set
        .... 0... .... = Congestion Window Reduced: Not set
        .... .0.. .... = ECN-Echo: Not set
        .... ..0. .... = Urgent: Not set
        .... ...1 .... = Acknowledgment: Set
        .... .... 0... = Push: Not set
        .... .... .0.. = Reset: Not set
        .... .... ..0. = Syn: Not set
        .... .... ...0 = Fin: Not set
        [TCP Flags: ·······A····]
    Window: 63185
    [Calculated window size: 63185]
    [Window size scaling factor: -1 (unknown)]
    Checksum: 0x62f1 [unverified]
    [Checksum Status: Unverified]
    Urgent Pointer: 0
    [Timestamps]
        [Time since first frame in this TCP stream: 0.024527000 seconds]
        [Time since previous frame in this TCP stream: 0.000045000 seconds]
    [SEQ/ACK analysis]
        [This is an ACK to the segment in frame: 4]
        [The RTT to ACK the segment was: 0.000045000 seconds]

No.     Time           Source                Destination           Protocol Length Info
      6 0.032024       134.188.170.174       134.188.170.175       TLSv1.2  97     Application Data

Frame 6: 97 bytes on wire (776 bits), 97 bytes captured (776 bits) on interface \Device\NPF_{33602CCE-19C0-4AAE-AECC-78912587524B}, id 0
    Section number: 1
    Interface id: 0 (\Device\NPF_{33602CCE-19C0-4AAE-AECC-78912587524B})
        Interface name: \Device\NPF_{33602CCE-19C0-4AAE-AECC-78912587524B}
        Interface description: Ethernet
    Encapsulation type: Ethernet (1)
    Arrival Time: Dec 14, 2022 10:37:36.778843000 W. Europe Standard Time
    [Time shift for this packet: 0.000000000 seconds]
    Epoch Time: 1671010656.778843000 seconds
    [Time delta from previous captured frame: 0.007497000 seconds]
    [Time delta from previous displayed frame: 0.007497000 seconds]
    [Time since reference or first frame: 0.032024000 seconds]
    Frame Number: 6
    Frame Length: 97 bytes (776 bits)
    Capture Length: 97 bytes (776 bits)
    [Frame is marked: False]
    [Frame is ignored: False]
    [Protocols in frame: eth:ethertype:ip:tcp:tls]
    [Coloring Rule Name: TCP]
    [Coloring Rule String: tcp]
Ethernet II, Src: Fujitsu_b0:3f:15 (a0:66:10:b0:3f:15), Dst: FujitsuT_11:23:49 (90:1b:0e:11:23:49)
    Destination: FujitsuT_11:23:49 (90:1b:0e:11:23:49)
        Address: FujitsuT_11:23:49 (90:1b:0e:11:23:49)
        .... ..0. .... .... .... .... = LG bit: Globally unique address (factory default)
        .... ...0 .... .... .... .... = IG bit: Individual address (unicast)
    Source: Fujitsu_b0:3f:15 (a0:66:10:b0:3f:15)
        Address: Fujitsu_b0:3f:15 (a0:66:10:b0:3f:15)
        .... ..0. .... .... .... .... = LG bit: Globally unique address (factory default)
        .... ...0 .... .... .... .... = IG bit: Individual address (unicast)
    Type: IPv4 (0x0800)
Internet Protocol Version 4, Src: 134.188.170.174, Dst: 134.188.170.175
    0100 .... = Version: 4
    .... 0101 = Header Length: 20 bytes (5)
    Differentiated Services Field: 0x00 (DSCP: CS0, ECN: Not-ECT)
        0000 00.. = Differentiated Services Codepoint: Default (0)
        .... ..00 = Explicit Congestion Notification: Not ECN-Capable Transport (0)
    Total Length: 83
    Identification: 0x1dd9 (7641)
    010. .... = Flags: 0x2, Don't fragment
        0... .... = Reserved bit: Not set
        .1.. .... = Don't fragment: Set
        ..0. .... = More fragments: Not set
    ...0 0000 0000 0000 = Fragment Offset: 0
    Time to Live: 128
    Protocol: TCP (6)
    Header Checksum: 0x79f5 [validation disabled]
    [Header checksum status: Unverified]
    Source Address: 134.188.170.174
    Destination Address: 134.188.170.175
Transmission Control Protocol, Src Port: 52728, Dst Port: 3389, Seq: 101, Ack: 1, Len: 43
    Source Port: 52728
    Destination Port: 3389
    [Stream index: 0]
    [Conversation completeness: Incomplete (12)]
    [TCP Segment Len: 43]
    Sequence Number: 101    (relative sequence number)
    Sequence Number (raw): 3951497663
    [Next Sequence Number: 144    (relative sequence number)]
    Acknowledgment Number: 1    (relative ack number)
    Acknowledgment number (raw): 1607889351
    0101 .... = Header Length: 20 bytes (5)
    Flags: 0x018 (PSH, ACK)
        000. .... .... = Reserved: Not set
        ...0 .... .... = Accurate ECN: Not set
        .... 0... .... = Congestion Window Reduced: Not set
        .... .0.. .... = ECN-Echo: Not set
        .... ..0. .... = Urgent: Not set
        .... ...1 .... = Acknowledgment: Set
        .... .... 1... = Push: Set
        .... .... .0.. = Reset: Not set
        .... .... ..0. = Syn: Not set
        .... .... ...0 = Fin: Not set
        [TCP Flags: ·······AP···]
    Window: 8212
    [Calculated window size: 8212]
    [Window size scaling factor: -1 (unknown)]
    Checksum: 0x48ac [unverified]
    [Checksum Status: Unverified]
    Urgent Pointer: 0
    [Timestamps]
        [Time since first frame in this TCP stream: 0.032024000 seconds]
        [Time since previous frame in this TCP stream: 0.007497000 seconds]
    [SEQ/ACK analysis]
        [Bytes in flight: 43]
        [Bytes sent since last PSH flag: 43]
    TCP payload (43 bytes)
Transport Layer Security
    TLSv1.2 Record Layer: Application Data Protocol: TPKT - ISO on TCP - RFC1006
        Content Type: Application Data (23)
        Version: TLS 1.2 (0x0303)
        Length: 38
        Encrypted Application Data: 000000000000215a58d594fa90cf3f0074d9974706145952ee44d7c92bdf7ede65413cb4…
        [Application Data Protocol: TPKT - ISO on TCP - RFC1006]

No.     Time           Source                Destination           Protocol Length Info
      7 0.037385       134.188.170.174       134.188.170.175       RDPUDP   60     [Malformed Packet]

Frame 7: 60 bytes on wire (480 bits), 60 bytes captured (480 bits) on interface \Device\NPF_{33602CCE-19C0-4AAE-AECC-78912587524B}, id 0
    Section number: 1
    Interface id: 0 (\Device\NPF_{33602CCE-19C0-4AAE-AECC-78912587524B})
        Interface name: \Device\NPF_{33602CCE-19C0-4AAE-AECC-78912587524B}
        Interface description: Ethernet
    Encapsulation type: Ethernet (1)
    Arrival Time: Dec 14, 2022 10:37:36.784204000 W. Europe Standard Time
    [Time shift for this packet: 0.000000000 seconds]
    Epoch Time: 1671010656.784204000 seconds
    [Time delta from previous captured frame: 0.005361000 seconds]
    [Time delta from previous displayed frame: 0.005361000 seconds]
    [Time since reference or first frame: 0.037385000 seconds]
    Frame Number: 7
    Frame Length: 60 bytes (480 bits)
    Capture Length: 60 bytes (480 bits)
    [Frame is marked: False]
    [Frame is ignored: False]
    [Protocols in frame: eth:ethertype:ip:udp:rdpudp]
    [Coloring Rule Name: UDP]
    [Coloring Rule String: udp]
Ethernet II, Src: Fujitsu_b0:3f:15 (a0:66:10:b0:3f:15), Dst: FujitsuT_11:23:49 (90:1b:0e:11:23:49)
    Destination: FujitsuT_11:23:49 (90:1b:0e:11:23:49)
        Address: FujitsuT_11:23:49 (90:1b:0e:11:23:49)
        .... ..0. .... .... .... .... = LG bit: Globally unique address (factory default)
        .... ...0 .... .... .... .... = IG bit: Individual address (unicast)
    Source: Fujitsu_b0:3f:15 (a0:66:10:b0:3f:15)
        Address: Fujitsu_b0:3f:15 (a0:66:10:b0:3f:15)
        .... ..0. .... .... .... .... = LG bit: Globally unique address (factory default)
        .... ...0 .... .... .... .... = IG bit: Individual address (unicast)
    Type: IPv4 (0x0800)
    Padding: 0000000000000000
Internet Protocol Version 4, Src: 134.188.170.174, Dst: 134.188.170.175
    0100 .... = Version: 4
    .... 0101 = Header Length: 20 bytes (5)
    Differentiated Services Field: 0x00 (DSCP: CS0, ECN: Not-ECT)
        0000 00.. = Differentiated Services Codepoint: Default (0)
        .... ..00 = Explicit Congestion Notification: Not ECN-Capable Transport (0)
    Total Length: 38
    Identification: 0x1dda (7642)
    000. .... = Flags: 0x0
        0... .... = Reserved bit: Not set
        .0.. .... = Don't fragment: Not set
        ..0. .... = More fragments: Not set
    ...0 0000 0000 0000 = Fragment Offset: 0
    Time to Live: 128
    Protocol: UDP (17)
    Header Checksum: 0xba16 [validation disabled]
    [Header checksum status: Unverified]
    Source Address: 134.188.170.174
    Destination Address: 134.188.170.175
User Datagram Protocol, Src Port: 63973, Dst Port: 3389
    Source Port: 63973
    Destination Port: 3389
    Length: 18
    Checksum: 0x55e2 [unverified]
    [Checksum Status: Unverified]
    [Stream index: 0]
    [Timestamps]
        [Time since first frame: 0.029961000 seconds]
        [Time since previous frame: 0.018950000 seconds]
    UDP payload (10 bytes)
UDP Remote Desktop Protocol
    snSourceAck: 0xb101c03f
    ReceiveWindowSize: 11980
    Flags: 0x8de0, CN, CWR, Ack of Acks, Ack delayed, Correlation id
        .... .... .... ...0 = Syn: False
        .... .... .... ..0. = Fin: False
        .... .... .... .0.. = Ack: False
        .... .... .... 0... = Data: False
        .... .... ...0 .... = FECData: False
        .... .... ..1. .... = CN: True
        .... .... .1.. .... = CWR: True
        .... ...1 .... .... = Ack of Acks: True
        .... ..0. .... .... = Syn lossy: False
        .... .1.. .... .... = Ack delayed: True
        .... 1... .... .... = Correlation id: True
        ...0 .... .... .... = SynEx: False
[Malformed Packet: RDPUDP]
    [Expert Info (Error/Malformed): Malformed Packet (Exception occurred)]
        [Malformed Packet (Exception occurred)]
        [Severity level: Error]
        [Group: Malformed]

No.     Time           Source                Destination           Protocol Length Info
      8 0.048729       134.188.170.174       134.188.170.175       TLSv1.2  104    Application Data

Frame 8: 104 bytes on wire (832 bits), 104 bytes captured (832 bits) on interface \Device\NPF_{33602CCE-19C0-4AAE-AECC-78912587524B}, id 0
    Section number: 1
    Interface id: 0 (\Device\NPF_{33602CCE-19C0-4AAE-AECC-78912587524B})
        Interface name: \Device\NPF_{33602CCE-19C0-4AAE-AECC-78912587524B}
        Interface description: Ethernet
    Encapsulation type: Ethernet (1)
    Arrival Time: Dec 14, 2022 10:37:36.795548000 W. Europe Standard Time
    [Time shift for this packet: 0.000000000 seconds]
    Epoch Time: 1671010656.795548000 seconds
    [Time delta from previous captured frame: 0.011344000 seconds]
    [Time delta from previous displayed frame: 0.011344000 seconds]
    [Time since reference or first frame: 0.048729000 seconds]
    Frame Number: 8
    Frame Length: 104 bytes (832 bits)
    Capture Length: 104 bytes (832 bits)
    [Frame is marked: False]
    [Frame is ignored: False]
    [Protocols in frame: eth:ethertype:ip:tcp:tls]
    [Coloring Rule Name: TCP]
    [Coloring Rule String: tcp]
Ethernet II, Src: Fujitsu_b0:3f:15 (a0:66:10:b0:3f:15), Dst: FujitsuT_11:23:49 (90:1b:0e:11:23:49)
    Destination: FujitsuT_11:23:49 (90:1b:0e:11:23:49)
        Address: FujitsuT_11:23:49 (90:1b:0e:11:23:49)
        .... ..0. .... .... .... .... = LG bit: Globally unique address (factory default)
        .... ...0 .... .... .... .... = IG bit: Individual address (unicast)
    Source: Fujitsu_b0:3f:15 (a0:66:10:b0:3f:15)
        Address: Fujitsu_b0:3f:15 (a0:66:10:b0:3f:15)
        .... ..0. .... .... .... .... = LG bit: Globally unique address (factory default)
        .... ...0 .... .... .... .... = IG bit: Individual address (unicast)
    Type: IPv4 (0x0800)
Internet Protocol Version 4, Src: 134.188.170.174, Dst: 134.188.170.175
    0100 .... = Version: 4
    .... 0101 = Header Length: 20 bytes (5)
    Differentiated Services Field: 0x00 (DSCP: CS0, ECN: Not-ECT)
        0000 00.. = Differentiated Services Codepoint: Default (0)
        .... ..00 = Explicit Congestion Notification: Not ECN-Capable Transport (0)
    Total Length: 90
    Identification: 0x1ddb (7643)
    010. .... = Flags: 0x2, Don't fragment
        0... .... = Reserved bit: Not set
        .1.. .... = Don't fragment: Set
        ..0. .... = More fragments: Not set
    ...0 0000 0000 0000 = Fragment Offset: 0
    Time to Live: 128
    Protocol: TCP (6)
    Header Checksum: 0x79ec [validation disabled]
    [Header checksum status: Unverified]
    Source Address: 134.188.170.174
    Destination Address: 134.188.170.175
Transmission Control Protocol, Src Port: 52728, Dst Port: 3389, Seq: 144, Ack: 1, Len: 50
    Source Port: 52728
    Destination Port: 3389
    [Stream index: 0]
    [Conversation completeness: Incomplete (12)]
    [TCP Segment Len: 50]
    Sequence Number: 144    (relative sequence number)
    Sequence Number (raw): 3951497706
    [Next Sequence Number: 194    (relative sequence number)]
    Acknowledgment Number: 1    (relative ack number)
    Acknowledgment number (raw): 1607889351
    0101 .... = Header Length: 20 bytes (5)
    Flags: 0x018 (PSH, ACK)
        000. .... .... = Reserved: Not set
        ...0 .... .... = Accurate ECN: Not set
        .... 0... .... = Congestion Window Reduced: Not set
        .... .0.. .... = ECN-Echo: Not set
        .... ..0. .... = Urgent: Not set
        .... ...1 .... = Acknowledgment: Set
        .... .... 1... = Push: Set
        .... .... .0.. = Reset: Not set
        .... .... ..0. = Syn: Not set
        .... .... ...0 = Fin: Not set
        [TCP Flags: ·······AP···]
    Window: 8212
    [Calculated window size: 8212]
    [Window size scaling factor: -1 (unknown)]
    Checksum: 0x9070 [unverified]
    [Checksum Status: Unverified]
    Urgent Pointer: 0
    [Timestamps]
        [Time since first frame in this TCP stream: 0.048729000 seconds]
        [Time since previous frame in this TCP stream: 0.016705000 seconds]
    [SEQ/ACK analysis]
        [Bytes in flight: 93]
        [Bytes sent since last PSH flag: 50]
    TCP payload (50 bytes)
Transport Layer Security
    TLSv1.2 Record Layer: Application Data Protocol: TPKT - ISO on TCP - RFC1006
        Content Type: Application Data (23)
        Version: TLS 1.2 (0x0303)
        Length: 45
        Encrypted Application Data: 000000000000215b7531f47a5d3d1370cafd761aeea69f3b6c975ca03709425d74ad5a10…
        [Application Data Protocol: TPKT - ISO on TCP - RFC1006]

No.     Time           Source                Destination           Protocol Length Info
      9 0.048754       134.188.170.175       134.188.170.174       TCP      54     3389 → 52728 [ACK] Seq=1 Ack=194 Win=63092 Len=0

Frame 9: 54 bytes on wire (432 bits), 54 bytes captured (432 bits) on interface \Device\NPF_{33602CCE-19C0-4AAE-AECC-78912587524B}, id 0
    Section number: 1
    Interface id: 0 (\Device\NPF_{33602CCE-19C0-4AAE-AECC-78912587524B})
        Interface name: \Device\NPF_{33602CCE-19C0-4AAE-AECC-78912587524B}
        Interface description: Ethernet
    Encapsulation type: Ethernet (1)
    Arrival Time: Dec 14, 2022 10:37:36.795573000 W. Europe Standard Time
    [Time shift for this packet: 0.000000000 seconds]
    Epoch Time: 1671010656.795573000 seconds
    [Time delta from previous captured frame: 0.000025000 seconds]
    [Time delta from previous displayed frame: 0.000025000 seconds]
    [Time since reference or first frame: 0.048754000 seconds]
    Frame Number: 9
    Frame Length: 54 bytes (432 bits)
    Capture Length: 54 bytes (432 bits)
    [Frame is marked: False]
    [Frame is ignored: False]
    [Protocols in frame: eth:ethertype:ip:tcp]
    [Coloring Rule Name: TCP]
    [Coloring Rule String: tcp]
Ethernet II, Src: FujitsuT_11:23:49 (90:1b:0e:11:23:49), Dst: Fujitsu_b0:3f:15 (a0:66:10:b0:3f:15)
    Destination: Fujitsu_b0:3f:15 (a0:66:10:b0:3f:15)
        Address: Fujitsu_b0:3f:15 (a0:66:10:b0:3f:15)
        .... ..0. .... .... .... .... = LG bit: Globally unique address (factory default)
        .... ...0 .... .... .... .... = IG bit: Individual address (unicast)
    Source: FujitsuT_11:23:49 (90:1b:0e:11:23:49)
        Address: FujitsuT_11:23:49 (90:1b:0e:11:23:49)
        .... ..0. .... .... .... .... = LG bit: Globally unique address (factory default)
        .... ...0 .... .... .... .... = IG bit: Individual address (unicast)
    Type: IPv4 (0x0800)
Internet Protocol Version 4, Src: 134.188.170.175, Dst: 134.188.170.174
    0100 .... = Version: 4
    .... 0101 = Header Length: 20 bytes (5)
    Differentiated Services Field: 0x00 (DSCP: CS0, ECN: Not-ECT)
        0000 00.. = Differentiated Services Codepoint: Default (0)
        .... ..00 = Explicit Congestion Notification: Not ECN-Capable Transport (0)
    Total Length: 40
    Identification: 0xdaa0 (55968)
    010. .... = Flags: 0x2, Don't fragment
        0... .... = Reserved bit: Not set
        .1.. .... = Don't fragment: Set
        ..0. .... = More fragments: Not set
    ...0 0000 0000 0000 = Fragment Offset: 0
    Time to Live: 128
    Protocol: TCP (6)
    Header Checksum: 0x0000 [validation disabled]
    [Header checksum status: Unverified]
    Source Address: 134.188.170.175
    Destination Address: 134.188.170.174
Transmission Control Protocol, Src Port: 3389, Dst Port: 52728, Seq: 1, Ack: 194, Len: 0
    Source Port: 3389
    Destination Port: 52728
    [Stream index: 0]
    [Conversation completeness: Incomplete (12)]
    [TCP Segment Len: 0]
    Sequence Number: 1    (relative sequence number)
    Sequence Number (raw): 1607889351
    [Next Sequence Number: 1    (relative sequence number)]
    Acknowledgment Number: 194    (relative ack number)
    Acknowledgment number (raw): 3951497756
    0101 .... = Header Length: 20 bytes (5)
    Flags: 0x010 (ACK)
        000. .... .... = Reserved: Not set
        ...0 .... .... = Accurate ECN: Not set
        .... 0... .... = Congestion Window Reduced: Not set
        .... .0.. .... = ECN-Echo: Not set
        .... ..0. .... = Urgent: Not set
        .... ...1 .... = Acknowledgment: Set
        .... .... 0... = Push: Not set
        .... .... .0.. = Reset: Not set
        .... .... ..0. = Syn: Not set
        .... .... ...0 = Fin: Not set
        [TCP Flags: ·······A····]
    Window: 63092
    [Calculated window size: 63092]
    [Window size scaling factor: -1 (unknown)]
    Checksum: 0x62f1 [unverified]
    [Checksum Status: Unverified]
    Urgent Pointer: 0
    [Timestamps]
        [Time since first frame in this TCP stream: 0.048754000 seconds]
        [Time since previous frame in this TCP stream: 0.000025000 seconds]
    [SEQ/ACK analysis]
        [This is an ACK to the segment in frame: 8]
        [The RTT to ACK the segment was: 0.000025000 seconds]

No.     Time           Source                Destination           Protocol Length Info
     10 0.064019       134.188.170.174       134.188.170.175       TLSv1.2  104    Application Data

Frame 10: 104 bytes on wire (832 bits), 104 bytes captured (832 bits) on interface \Device\NPF_{33602CCE-19C0-4AAE-AECC-78912587524B}, id 0
    Section number: 1
    Interface id: 0 (\Device\NPF_{33602CCE-19C0-4AAE-AECC-78912587524B})
